{
  "schema": "clipper.motion_selection.v0.1",
  "workflow_id": "yt_clip_hype_captions_v1",
  "notes": "Readability-first; one stinger max; CTA near the end.",
  "templates": [
    {
      "template_id": "clipops.captions.word_highlight.v1",
      "params": { "lookahead_ms": 80 }
    },
    {
      "template_id": "alpha.remotion.stinger.burst.v1",
      "params": { "intensity": 0.4 },
      "timing": { "dst_in_ms": 3200, "dur_ms": 900 }
    },
    {
      "template_id": "alpha.cta.like_subscribe.v1",
      "timing": { "dst_in_ms": 9800, "dur_ms": 1200 }
    }
  ]
}
